{
 "contact_support": {
  "14,20": 1.0,
  "14,21": 1.0,
  "14,56": 1.0,
  "15,18": 1.0,
  "15,20": 1.0,
  "15,21": 1.0,
  "15,22": 1.0,
  "16,14": 0.5,
  "16,15": 1.0,
  "16,16": 1.0,
  "16,17": 1.0,
  "16,18": 1.0,
  "16,20": 1.0,
  "16,21": 1.0,
  "16,22": 1.0,
  "16,23": 1.0,
  "17,18": 1.0,
  "17,20": 1.0,
  "18,21": 0.5,
  "31,57": 1.0,
  "31,58": 1.0,
  "31,59": 1.0,
  "32,19": 1.0,
  "32,58": 0.5,
  "39,15": 0.5,
  "40,15": 1.0,
  "41,16": 1.0,
  "41,17": 1.0,
  "45,15": 0.5,
  "45,16": 1.0,
  "45,17": 1.0,
  "47,18": 1.0,
  "47,19": 1.0,
  "47,20": 1.0,
  "48,19": 1.0,
  "48,20": 1.0,
  "49,19": 1.0,
  "49,20": 1.0,
  "50,19": 1.0,
  "50,57": 1.0,
  "50,58": 1.0,
  "52,57": 1.0,
  "52,58": 1.0,
  "53,19": 1.0,
  "53,20": 1.0,
  "53,56": 1.0,
  "53,57": 1.0
 },
 "engine_pairs": [],
 "environment": {
  "biopython": "1.84",
  "matplotlib": "3.9.2",
  "numpy": "1.26.4",
  "package_version": "rnpbench-predict-1.0.0",
  "platform": "Linux-7.0.0-34-generic-x86_64-with-glibc2.43",
  "python": "3.11.17"
 },
 "package_version": "rnpbench-predict-1.0.0",
 "per_output": [
  {
   "chain_lengths": [
    [
     "A",
     98
    ],
    [
     "B",
     60
    ]
   ],
   "cross_engine_support": null,
   "declared_lengths": null,
   "engine": "BOLTZ2",
   "error": null,
   "execution": "exec_A",
   "n_contacts": 44,
   "n_other_engines_compared": 0,
   "n_protein_copies": 1,
   "n_rna_copies": 1,
   "n_surface": 16,
   "native": 0.8936354517936707,
   "native_kind": "iptm",
   "no_interface_contact": false,
   "repeat_register_agreement": 0.8936170212765957,
   "sha256": "9c1a6659f60fa28011b4deae449524146aaba822529e2f065a541b0d1a968009",
   "state": "ELIGIBLE"
  },
  {
   "chain_lengths": [
    [
     "A",
     98
    ],
    [
     "B",
     60
    ]
   ],
   "cross_engine_support": null,
   "declared_lengths": null,
   "engine": "BOLTZ2",
   "error": null,
   "execution": "exec_B",
   "n_contacts": 45,
   "n_other_engines_compared": 0,
   "n_protein_copies": 1,
   "n_rna_copies": 1,
   "n_surface": 16,
   "native": 0.9002814888954163,
   "native_kind": "iptm",
   "no_interface_contact": false,
   "repeat_register_agreement": 0.8936170212765957,
   "sha256": "89f54c2af3b97e38858fcb590c5fa55b6755f122a5c28b7b298b377aedd4f049",
   "state": "ELIGIBLE"
  }
 ],
 "schema_version": "rnpbench-predict-result-1",
 "summary": {
  "NO_ACCURACY_IS_COMPUTED": true,
  "NO_REFERENCE_STRUCTURE_IS_READ": true,
  "SEMANTICS": "agreement is descriptive evidence about convergence of predicted interface hypotheses; it is not a probability of structural correctness",
  "case_id": "7K9D_example",
  "construct": {
   "protein_length": 98,
   "protein_sequence": "GPSPEIGQIVKIVKGRDRDQFSVIIKRVDDRFVYIADGDKRKVDRAKRKNMNHLKLIDHISPEVRHSFEETGKVTNGKLRFALKKFLEEHADLLKEGE",
   "rna_length": 60,
   "rna_sequence": "GGCCAGUCUGGCGUUUGGUGACAGCGCCAAGUUCUUCGGAAUUGGGAAAUCCUACUGGCC"
  },
  "contact_support_histogram": {
   "1": 42
  },
  "eligible_engines": [
   "BOLTZ2"
  ],
  "hypothesis_thresholds": [
   0.3,
   0.5,
   0.7
  ],
  "ineligible": [],
  "interface_hypotheses": {
   "0.3": [
    [
     "BOLTZ2"
    ]
   ],
   "0.5": [
    [
     "BOLTZ2"
    ]
   ],
   "0.7": [
    [
     "BOLTZ2"
    ]
   ]
  },
  "median_pairwise_register_agreement": null,
  "median_pairwise_rna_pose_difference_A": null,
  "median_pairwise_surface_agreement": null,
  "n_contacts_proposed_by_any_engine": 47,
  "n_declared_outputs": 2,
  "n_eligible_engines": 1,
  "n_eligible_outputs": 2,
  "n_hypotheses_at_primary_threshold": 1,
  "outputs_with_no_interface_contact": [],
  "primary_threshold": 0.5,
  "repeat_agreement": {
   "BOLTZ2": {
    "register_agreement": 0.8936170212765957,
    "rna_pose_copy_permutation_capped": false,
    "rna_pose_difference_A": 0.957383346052161,
    "surface_agreement": 0.8823529411764706
   }
  }
 },
 "wall_s": 0.08
}